<?xml version="1.0" encoding="UTF-8"?>

<!--  Main configuration file for Android DTN Project -->
<tns:DTNConfiguration xmlns:tns="http://www.bytewalla.tslab.ssvl.kth.se/DTNConf" xmlns:xsi="http://www.w3.org/2001/XMLSchema-instance" xsi:schemaLocation="http://www.bytewalla.tslab.ssvl.kth.se/DTNConf dtn.config.xsd">
			
	<!--  Storage Section -->
	<!--  Setup your storage here -->
	<!--  type can be phone or sdcard -->
	<!--  quota is the space you will allow DTN to store bundles
	  in the storage type you set, the unit is Megabytes -->
	<tns:StorageSetting type="sdcard" quota="50" storage_path="dtn"/>
	
	
	<!--  Interfaces Section -->
	<tns:InterfacesSetting>
	<!--  Setup your listening interfaces here -->
	   <tns:Interface id="tcp0" conv_layer_type="tcp"  local_port="7000"/>
	</tns:InterfacesSetting>
	
	
	<!--  Links Section -->
	<tns:LinksSetting>
	<!--  Setup your links here -->
		<tns:Link id="village_tcp_link" conv_layer_type="tcp" dest="10.0.2.2:9000" type="ONDEMAND" />
		<tns:Link id="city_tcp_link"    conv_layer_type="tcp" dest="10.0.2.2:9001" type="ONDEMAND" />
		
	</tns:LinksSetting>
	
	
	<!--  Routes Section -->
	<tns:RoutesSetting router_type="static" local_eid="dtn://rerngvit.bytewalla.com">
	<!--  Setup your routes here -->
		<tns:Route dest="dtn://village.bytewalla.com/*" link_id="village_tcp_link"/>
		<tns:Route dest="dtn://city.bytewalla.com/*" link_id="city_tcp_link"/>
	</tns:RoutesSetting>
	
	
	<tns:DiscoveriesSetting>
	<!--  Setup your Discovery here -->
	</tns:DiscoveriesSetting>
	
</tns:DTNConfiguration>