<?xml version="1.0" encoding="UTF-8"?>

    <!--  Main configuration file for Android DTN Project -->
    <!--  Its XML Schema is dtn.config.xsd in the same folder -->
<tns:DTNConfiguration xmlns:tns="http://www.bytewalla.tslab.ssvl.kth.se/DTNConf"
    xmlns:xsi="http://www.w3.org/2001/XMLSchema-instance"
    xsi:schemaLocation="http://www.bytewalla.tslab.ssvl.kth.se/DTNConf dtn.config.xsd">

    <!--  Storage Section -->
    <!--  Setup your storage here -->
    <!--
        quota is the space you will allow DTN to store bundles in the storage
        type you set, the unit is Megabytes
    -->
    <tns:StorageSetting quota="1" storage_path="test/se/kth/ssvl/tslab/wsn/general/servlib/config/build/dtn" test_data_log="true"/>


    <!--  Interfaces Section -->
    <tns:InterfacesSetting>
        <!--  Setup your listening interfaces here -->
        <tns:Interface id="tcp0" conv_layer_type="tcp"
            local_port="4556" />
    </tns:InterfacesSetting>


    <!--  Links Section -->
    <tns:LinksSetting proactive_fragmentation="true" fragmentation_mtu="5000">
        <!--  Setup your links here -->
        <tns:Link id="bifrost_tcp_link" conv_layer_type="tcp" dest="192.168.0.1:4556" type="ONDEMAND" />
    </tns:LinksSetting>


    <!--  Routes Section -->
    <tns:RoutesSetting local_eid="dtn://linux.dtn" router_type="prophet" P_encounter="0.5"
        P_encounter_first="0.25" delta="0.01" alpha="0.5" beta="0.9" K="1" queuing="Fifo">
        <!--  Setup your routes here -->
        <tns:Route dest="dtn://city.bytewalla.com/*" link_id="bifrost_tcp_link"/>
        <tns:Route dest="dtn://village.bytewalla.com/*" link_id="bifrost_tcp_link"/>
        <tns:Route dest="dtn://bifrost.bytewalla.com/*" link_id="bifrost_tcp_link"/>
    </tns:RoutesSetting>

    <tns:DiscoveriesSetting>
        <!--  Setup your Discovery here -->
        <tns:Discovery id="ipdisc0" address_family="ip" port="9556"></tns:Discovery>
        <tns:Announce interface_id="tcp0" discovery_id="ipdisc0"
            conv_layer_type="tcp"></tns:Announce>
    </tns:DiscoveriesSetting>
    
    <!-- Security Settings -->
    <!-- ks_path: the path to the keystore -->
    <!-- ks_password: password to access the keystore -->
    <!-- use_pcb [true|false]: Payload Confidentiality Block for confidentiality and integrity -->
    <!-- use_pib [true|false]: Payload Integrity Block for integrity and authenticity -->
    <tns:SecuritySetting ks_path="path/to/keystore" ks_password="password" use_pcb="true" use_pib="false"></tns:SecuritySetting>

</tns:DTNConfiguration>
	  